{
  "subject": "TR1",
  "statedAs": "Reading.apply_reading_some_matches_spec",
  "statementDigest": "sha256:45b44a7d08e722686c5d2bb5aadefbb37f090948d5564d0726514dffb68a4e0b",
  "method": "Proof",
  "scope": "EveryBoundValueAndList",
  "assumptionAudit": "no sorry/oops in Reading.thy (gate.py's source scan)",
  "tool": { "name": "Isabelle", "version": "Isabelle2025-2" },
  "outcome": "passed"
}
