{
  "subject": "TA1",
  "statedAs": "Kernel.or3_monotone_left/right, and3_monotone_left/right",
  "statementDigest": "sha256:3d150a77ae3904e18f768e198af16adee3cdf1ed74b9d905c5e743de91b4de7c",
  "method": "Proof",
  "scope": "EveryPair",
  "assumptionAudit": "no sorry/oops in Kernel.thy (gate.py's source scan)",
  "tool": { "name": "Isabelle", "version": "Isabelle2025-2" },
  "outcome": "passed"
}
