{
  "subject": "TL2",
  "statedAs": "Eligibility.some_value_monotone/every_value_monotone",
  "statementDigest": "sha256:ff15bf02120aa90e15abe3aad5175a2f909f3d55d2aafaf6a616a31bccfe1ac7",
  "method": "Proof",
  "scope": "EveryRelatedListPair",
  "assumptionAudit": "no sorry/oops in Eligibility.thy (gate.py's source scan)",
  "tool": { "name": "Isabelle", "version": "Isabelle2025-2" },
  "outcome": "passed"
}
