{
  "subject": "TL1-every",
  "statedAs": "Eligibility.every_value_spec_denied/permitted/undetermined",
  "statementDigest": "sha256:e3184dd4cac509b615ec8501b28a06c292d71eb949020df14dac8bf74ed11d71",
  "method": "Proof",
  "scope": "EveryList",
  "assumptionAudit": "no sorry/oops in Eligibility.thy (gate.py's source scan)",
  "tool": { "name": "Isabelle", "version": "Isabelle2025-2" },
  "outcome": "passed"
}
